{
  "currency": "USD",
  "input_per_million": "1.00",
  "model": "anthropic/claude-haiku-4-5-20251001",
  "output_per_million": "5.00",
  "price_table_version": "245d2d3dd12226e11e1328b65a7a63eb2db964b9e40a71eb56a0f30d07e6bcc2",
  "retrieved_at": "2026-09-25T00:00:00Z",
  "schema_version": "price-table-v1",
  "source_url": "https://platform.claude.com/docs/en/about-claude/pricing"
}
